{
  "$schema": "https://json-schema.org/draft/2020-12/schema",
  "$id": "https://thetashield.local/schemas/deployment-manifest.schema.json",
  "title": "ThetaShield Circle and Reactive Legacy deployment manifest",
  "type": "object",
  "additionalProperties": false,
  "required": ["schema_version", "mode", "source_revision", "created_at", "networks", "components", "circle_messages", "acceptance", "cost"],
  "properties": {
    "schema_version": { "const": 3 },
    "mode": { "enum": ["dry-run", "live"] },
    "source_revision": { "type": "string", "pattern": "^[0-9a-f]{40}$" },
    "created_at": { "type": "string", "format": "date-time" },
    "profile": {
      "type": "object",
      "additionalProperties": false,
      "required": ["name", "id"],
      "properties": {
        "name": { "enum": ["RESEARCH_V1", "DEMO_V1"] },
        "id": { "type": "string", "pattern": "^0x[0-9a-fA-F]{64}$" }
      }
    },
    "reference_sampler": {
      "type": "object",
      "additionalProperties": false,
      "required": ["mode", "feed_address", "market_id", "sources"],
      "properties": {
        "mode": { "enum": ["pool-median", "owner-published-demo"] },
        "feed_address": { "type": "string", "pattern": "^0x[0-9a-fA-F]{40}$" },
        "market_id": { "type": "string", "pattern": "^0x[0-9a-fA-F]{64}$" },
        "sources": {
          "type": "array",
          "minItems": 1,
          "maxItems": 16,
          "items": {
            "type": "object",
            "additionalProperties": false,
            "required": ["source_id", "pool_id", "minimum_liquidity"],
            "properties": {
              "source_id": { "type": "string", "pattern": "^0x[0-9a-fA-F]{64}$" },
              "pool_id": { "type": ["string", "null"], "pattern": "^0x[0-9a-fA-F]{64}$" },
              "minimum_liquidity": { "type": ["string", "null"], "pattern": "^[0-9]+$" }
            }
          }
        }
      }
    },
    "reactive_automation": {
      "type": "object",
      "additionalProperties": false,
      "required": ["mode", "network_name", "chain_id", "rpc_secret_name", "system_contract", "system_code_hash", "cron_name", "cron_topic", "destination_chain_id", "callback_proxy", "deployer_rvm_id", "executor_address", "rsc_address", "executor_transaction_hash", "rsc_transaction_hash", "callback_transaction_hash", "status"],
      "properties": {
        "mode": { "const": "legacy-lasna" },
        "network_name": { "const": "Reactive Lasna" },
        "chain_id": { "const": 5318007 },
        "rpc_secret_name": { "const": "REACTIVE_RPC_URL" },
        "system_contract": { "const": "0x0000000000000000000000000000000000fffFfF" },
        "system_code_hash": { "const": "0x29fce405ff34f9c7a0bb44f9e6241ca21807dc47ac9b8c4f6bdd2eb748a67465" },
        "cron_name": { "const": "Cron10" },
        "cron_topic": { "const": "0x04463f7c1651e6b9774d7f85c85bb94654e3c46ca79b0c16fb16d4183307b687" },
        "destination_chain_id": { "const": 11155111 },
        "callback_proxy": { "const": "0xc9f36411C9897e7F959D99ffca2a0Ba7ee0D7bDA" },
        "deployer_rvm_id": { "type": "string", "pattern": "^0x[0-9a-fA-F]{40}$" },
        "executor_address": { "type": ["string", "null"], "pattern": "^0x[0-9a-fA-F]{40}$" },
        "rsc_address": { "type": ["string", "null"], "pattern": "^0x[0-9a-fA-F]{40}$" },
        "executor_transaction_hash": { "type": ["string", "null"], "pattern": "^0x[0-9a-fA-F]{64}$" },
        "rsc_transaction_hash": { "type": ["string", "null"], "pattern": "^0x[0-9a-fA-F]{64}$" },
        "callback_transaction_hash": { "type": ["string", "null"], "pattern": "^0x[0-9a-fA-F]{64}$" },
        "status": { "enum": ["not-started", "deployed", "callback-proven", "failed"] }
      }
    },
    "networks": {
      "type": "array",
      "minItems": 2,
      "items": {
        "type": "object",
        "additionalProperties": false,
        "required": ["role", "name", "chain_id", "circle_domain", "message_transmitter", "rpc_secret_name"],
        "properties": {
          "role": { "enum": ["origin", "processor"] },
          "name": { "type": "string", "minLength": 1 },
          "chain_id": { "type": "integer", "minimum": 1 },
          "circle_domain": { "type": "integer", "minimum": 0, "maximum": 4294967295 },
          "message_transmitter": { "type": "string", "pattern": "^0x[0-9a-fA-F]{40}$" },
          "rpc_secret_name": { "type": "string", "minLength": 1 }
        }
      }
    },
    "components": {
      "type": "array",
      "items": {
        "type": "object",
        "additionalProperties": false,
        "required": ["name", "network_role", "address", "transaction_hash", "block_number", "explorer_url", "verified"],
        "properties": {
          "name": { "type": "string", "minLength": 1 },
          "network_role": { "enum": ["origin", "processor", "reactive"] },
          "address": { "type": ["string", "null"], "pattern": "^0x[0-9a-fA-F]{40}$" },
          "transaction_hash": { "type": ["string", "null"], "pattern": "^0x[0-9a-fA-F]{64}$" },
          "block_number": { "type": ["integer", "null"], "minimum": 0 },
          "explorer_url": { "type": ["string", "null"], "format": "uri" },
          "verified": { "type": "boolean" }
        }
      }
    },
    "circle_messages": {
      "type": "array",
      "items": {
        "type": "object",
        "additionalProperties": false,
        "required": ["kind", "source_domain", "destination_domain", "send_transaction_hash", "relay_transaction_hash", "message_hash", "status"],
        "properties": {
          "kind": { "enum": ["observation", "recommendation"] },
          "source_domain": { "type": "integer", "minimum": 0 },
          "destination_domain": { "type": "integer", "minimum": 0 },
          "send_transaction_hash": { "type": ["string", "null"], "pattern": "^0x[0-9a-fA-F]{64}$" },
          "relay_transaction_hash": { "type": ["string", "null"], "pattern": "^0x[0-9a-fA-F]{64}$" },
          "message_hash": { "type": ["string", "null"], "pattern": "^0x[0-9a-fA-F]{64}$" },
          "status": { "enum": ["not-started", "pending", "complete", "failed"] }
        }
      }
    },
    "acceptance": {
      "type": "object",
      "additionalProperties": false,
      "required": ["preflight_fingerprints", "initial_swap_transaction_hash", "reference_transaction_hash", "processor_transaction_hash", "later_swap_transaction_hash", "expected_fee_pips", "observed_fee_pips", "passed"],
      "properties": {
        "preflight_fingerprints": { "type": "array", "items": { "type": "string", "pattern": "^0x[0-9a-fA-F]{64}$" } },
        "initial_swap_transaction_hash": { "type": ["string", "null"], "pattern": "^0x[0-9a-fA-F]{64}$" },
        "reference_transaction_hash": { "type": ["string", "null"], "pattern": "^0x[0-9a-fA-F]{64}$" },
        "processor_transaction_hash": { "type": ["string", "null"], "pattern": "^0x[0-9a-fA-F]{64}$" },
        "later_swap_transaction_hash": { "type": ["string", "null"], "pattern": "^0x[0-9a-fA-F]{64}$" },
        "reactive_callback_transaction_hash": { "type": ["string", "null"], "pattern": "^0x[0-9a-fA-F]{64}$" },
        "reactive_cycle_id": { "type": ["integer", "null"], "minimum": 1 },
        "expected_fee_pips": { "type": ["integer", "null"], "minimum": 0, "maximum": 1000000 },
        "observed_fee_pips": { "type": ["integer", "null"], "minimum": 0, "maximum": 1000000 },
        "passed": { "type": "boolean" }
      }
    },
    "cost": {
      "type": "array",
      "minItems": 2,
      "items": {
        "type": "object",
        "additionalProperties": false,
        "required": ["network_role", "currency", "gas_limit", "fee_cap_wei", "estimated_maximum", "actual", "approved_by_owner"],
        "properties": {
          "network_role": { "enum": ["origin", "processor", "reactive"] },
          "currency": { "type": "string", "minLength": 1 },
          "gas_limit": { "type": "integer", "minimum": 0 },
          "fee_cap_wei": { "type": "string", "pattern": "^[0-9]+$" },
          "estimated_maximum": { "type": "string", "pattern": "^[0-9]+(\\.[0-9]+)?$" },
          "actual": { "type": ["string", "null"], "pattern": "^[0-9]+(\\.[0-9]+)?$" },
          "approved_by_owner": { "type": "boolean" }
        }
      }
    }
  }
}
