{
  "schema_version": 3,
  "mode": "live",
  "source_revision": "7dcaadad351b238a64133f053f195e11d9a2ef71",
  "created_at": "2026-08-22T08:57:35Z",
  "networks": [
    {
      "role": "origin",
      "name": "Unichain Sepolia",
      "chain_id": 1301,
      "circle_domain": 10,
      "message_transmitter": "0xE737e5cEBEEBa77EFE34D4aa090756590b1CE275",
      "rpc_secret_name": "ORIGIN_RPC_URL"
    },
    {
      "role": "processor",
      "name": "Ethereum Sepolia",
      "chain_id": 11155111,
      "circle_domain": 0,
      "message_transmitter": "0xE737e5cEBEEBa77EFE34D4aa090756590b1CE275",
      "rpc_secret_name": "PROCESSOR_RPC_URL"
    }
  ],
  "components": [
    {
      "name": "ThetaShieldCircleTransport",
      "network_role": "origin",
      "address": "0x24daf359bA811c9dd6903649b968eC6D76C3e568",
      "transaction_hash": "0x6c54f3f1d462d89672ddebaa71043d5de45248ec1a858af12d164f687d5a9c48",
      "block_number": 60516368,
      "explorer_url": "https://unichain-sepolia.blockscout.com/address/0x24daf359bA811c9dd6903649b968eC6D76C3e568",
      "verified": false
    },
    {
      "name": "ThetaShieldController",
      "network_role": "origin",
      "address": "0x6db44e172C7E1bae468A6e1e3683f34D7f3fD791",
      "transaction_hash": "0x5a002ef1f0970050d9e1cdcb50baa83caf7d33da27fd8f06ae5bc29d4f743d40",
      "block_number": 60516378,
      "explorer_url": "https://unichain-sepolia.blockscout.com/address/0x6db44e172C7E1bae468A6e1e3683f34D7f3fD791",
      "verified": false
    },
    {
      "name": "ThetaShieldTestToken0",
      "network_role": "origin",
      "address": "0x0627aFF7157a9d6A81Af63AdED4AdFD113F6690D",
      "transaction_hash": "0xcd3e5d382258ac08c217548654369445dbef12b04c6cb1df14385866f3872dc9",
      "block_number": 60516387,
      "explorer_url": "https://unichain-sepolia.blockscout.com/address/0x0627aFF7157a9d6A81Af63AdED4AdFD113F6690D",
      "verified": false
    },
    {
      "name": "ThetaShieldTestToken1",
      "network_role": "origin",
      "address": "0xc069A2ad03c24C30b662BD0d998031f68C8A9D5A",
      "transaction_hash": "0x6c3f09e88b46eb46d4e9367cbbe2f7e13f8557ae2ec961334a37c88e5eb52e0b",
      "block_number": 60516398,
      "explorer_url": "https://unichain-sepolia.blockscout.com/address/0xc069A2ad03c24C30b662BD0d998031f68C8A9D5A",
      "verified": false
    },
    {
      "name": "ThetaShieldHookFactory",
      "network_role": "origin",
      "address": "0xd01D5C3bBdf7D23cAA3bC3bB90AdEd6209Db74C6",
      "transaction_hash": "0x4624239a356892d4d9e4622e655ecaa0b12bdfc4cb0ad2ab369ddecde2124a10",
      "block_number": 60516408,
      "explorer_url": "https://unichain-sepolia.blockscout.com/address/0xd01D5C3bBdf7D23cAA3bC3bB90AdEd6209Db74C6",
      "verified": false
    },
    {
      "name": "ThetaShieldHook",
      "network_role": "origin",
      "address": "0xC53d57f4778E67B73B5535dEb2B841D56CBE40C0",
      "transaction_hash": "0x2526bd5bcc0788c27578218a8a76b9cff1d84503f2315c6bee5ce8befbc21314",
      "block_number": 60516420,
      "explorer_url": "https://unichain-sepolia.blockscout.com/address/0xC53d57f4778E67B73B5535dEb2B841D56CBE40C0",
      "verified": false
    },
    {
      "name": "MockNormalizedReferencePriceFeed",
      "network_role": "processor",
      "address": "0x7138a53A06527bb68f74D4DcA31c46acAb8c1BAc",
      "transaction_hash": "0x6804ef3437342ba7ffad1e47bd1c9b6e17dc744dd339e7f49c632b6f827f0a1c",
      "block_number": 11540370,
      "explorer_url": "https://eth-sepolia.blockscout.com/address/0x7138a53A06527bb68f74D4DcA31c46acAb8c1BAc",
      "verified": false
    },
    {
      "name": "ThetaShieldCircleProcessor",
      "network_role": "processor",
      "address": "0x10970CC15d1DF81bA6c8968F87036b21c694d744",
      "transaction_hash": "0xfabbdeefea275200805fcb8de62f470e1c4f689dab509ade02257853108838a6",
      "block_number": 11540371,
      "explorer_url": "https://eth-sepolia.blockscout.com/address/0x10970CC15d1DF81bA6c8968F87036b21c694d744",
      "verified": false
    }
  ],
  "circle_messages": [
    {
      "kind": "observation",
      "source_domain": 10,
      "destination_domain": 0,
      "send_transaction_hash": "0x8ea09588f0e7bbf07e6f42ef20aaedbbe40823241f7d14642f88af0e3dec2b57",
      "relay_transaction_hash": "0x77bfbedb0547872aad873e76cd88ee50a10f685507ad04e44817be14dcc11ee4",
      "message_hash": "0xa047f85185bc8b6a727047db0bb682757c72d9e8926fe71c84b7c0cb3d35aee9",
      "status": "complete"
    },
    {
      "kind": "observation",
      "source_domain": 10,
      "destination_domain": 0,
      "send_transaction_hash": "0xb81b1e11daa419162a172b84636ba8d0398c7da9e7fe90b59224e2535e33f5d6",
      "relay_transaction_hash": "0x52c7f55ff3c85a31cbf1990cce3f0d5290133304302d45533fd449e2f26583f9",
      "message_hash": "0xded77a2de7d66e46b2831f109ad240783e271f3f2084ef5ac269d18148ffff16",
      "status": "complete"
    },
    {
      "kind": "recommendation",
      "source_domain": 0,
      "destination_domain": 10,
      "send_transaction_hash": "0x7d58946a80cc2fb604feb784c547fdfc2055b940aa3101af5e3cb3d5e2c7cfb0",
      "relay_transaction_hash": "0xb39029264e3828380c23f5ca97c279371bcf5c518def0f1b95f1db6b3f6aeb19",
      "message_hash": "0xf8f3424e41f8b0b19af4ea4ed0fd809cec7ae833bffb4aa31a279fb1778207bd",
      "status": "complete"
    },
    {
      "kind": "observation",
      "source_domain": 10,
      "destination_domain": 0,
      "send_transaction_hash": "0x79ff916f7f2cb6501cc2eaf032955355dac9f9bad85c51a4fe11f14ed0637853",
      "relay_transaction_hash": null,
      "message_hash": "0x0a9dda29b7cfa9c3acab02a79a504532e6244cbce50e289052ef20d38755cd73",
      "status": "not-started"
    }
  ],
  "acceptance": {
    "preflight_fingerprints": [
      "0xa8b66d1681515ccd4fb13db85701f70e09c34a41d06bcead46171c5069c03113",
      "0x71c58a54f00469bdb017ecf926a37a0d5e505d308be4fd41ee162f2c6ce819c6"
    ],
    "initial_swap_transaction_hash": "0xb81b1e11daa419162a172b84636ba8d0398c7da9e7fe90b59224e2535e33f5d6",
    "reference_transaction_hash": "0xc2aef5c9bbd8dae427d4c51df2bbb8de2fcd60d0078bbcd5201add45ae04efd8",
    "processor_transaction_hash": "0x7d58946a80cc2fb604feb784c547fdfc2055b940aa3101af5e3cb3d5e2c7cfb0",
    "later_swap_transaction_hash": "0x79ff916f7f2cb6501cc2eaf032955355dac9f9bad85c51a4fe11f14ed0637853",
    "expected_fee_pips": 500,
    "observed_fee_pips": 500,
    "passed": true
  },
  "cost": [
    {
      "network_role": "origin",
      "currency": "Unichain Sepolia ETH",
      "gas_limit": 25000000,
      "fee_cap_wei": "2000000",
      "estimated_maximum": "0.000050000",
      "actual": "0.000007574347000000",
      "approved_by_owner": true
    },
    {
      "network_role": "processor",
      "currency": "Ethereum Sepolia ETH",
      "gas_limit": 12005266,
      "fee_cap_wei": "2500000000",
      "estimated_maximum": "0.030013166",
      "actual": "0.014809343349884545",
      "approved_by_owner": true
    }
  ]
}
